<?xml version="1.0" encoding="UTF-8"?>
<aop-component xmlns:xsi="http://www.w3.org/2001/XMLSchema-instance"
	xsi:noNamespaceSchemaLocation="http://xson.org/schema/tangyuan/aop/1.2.2/component.xsd">
	
	<before exec="abc" mode="EXTEND" order="" cloneArg="true/false">
		<include type="GROUP/NAME/SERVICE_TYPE">*</include>
		<include type="GROUP/NAME">*</include>
	</before>
	
	<before exec="a/b" mode="EXTEND" order="">
		<include>abc*</include>
	</before>
	
	<after exec="c/d" mode="EXTEND" order="" condition="ALL" cloneArg="true/false">
		<include></include>
	</after>
	
</aop-component>